{
  "schema": "inflight.shard::1.0",
  "written_at": "2026-06-26T15:30:00+00:00",
  "object": {
    "name": "Inflight preview example",
    "criticality": "Low",
    "metadata": {
      "uuid": "aaaaaaaa-bbbb-4ccc-8ddd-eeeeeeeeeeee",
      "schema": "threat::1.0",
      "version": 1,
      "created": "2026-06-26",
      "modified": "2026-06-26",
      "tlp": "clear",
      "organisation": {
        "uuid": "56b0a0f0-b0bc-47d9-bb46-02f80ae2065a",
        "name": "opentide Example"
      }
    },
    "threat": {
      "actors": [],
      "killchain": "Reconnaissance",
      "att&ck": ["T1595"],
      "terrain": "Example only — no operational terrain.",
      "severity": "Localised incident",
      "leverage": "Example",
      "impact": "Example",
      "viability": "Unlikely",
      "description": "Example threat object used to validate inflight preview shard generation in CI."
    }
  },
  "change": {
    "platform": "github",
    "number": 4,
    "url": "https://github.com/opentidehq/library/pull/4",
    "title": "example/inflight-preview",
    "head_ref": "example/inflight-preview",
    "base_ref": "main",
    "head_sha": "1a2b3c4d5e6f7890abcdef1234567890abcdef12",
    "source_path": "objects/threats/inflight-preview-example.yaml",
    "recorded_at": "2026-06-26T15:30:00+00:00"
  }
}
